rule_id,signature,trigger,proposed_transformation,unique_task_support,cell_support,supporting_task_ids,counterexamples,semantic_risk,evaluator_blind_evidence,safety_guard,abstention_conditions,recommended_status,verified_rule,evaluator_result_used_to_accept_repair
entrypoint_alias_unique_arity_compatible_v0,entrypoint_unique_arity_compatible_candidate,source parses; expected entry point absent and unbound; exactly one undecorated synchronous top-level function; all model-visible positional arities compatible,append a name-only alias: expected_entry_point = existing_function; never rewrite the body,16,42,Mbpp/119|Mbpp/237|Mbpp/244|Mbpp/255|Mbpp/287|Mbpp/406|Mbpp/435|Mbpp/453|Mbpp/576|Mbpp/626|Mbpp/721|Mbpp/739|Mbpp/765|Mbpp/769|Mbpp/781|Mbpp/792,4 cells/4 tasks lack a unique safe candidate: Mbpp/125|Mbpp/237|Mbpp/622|Mbpp/739,moderate; alias preserves body but exported-name intent can still be ambiguous,"AST names, function count/signature, and model-visible call arity only; no evaluator outcome is consulted to accept a repair",one function only; exact arity compatibility; no target binding; no body/control-flow/import changes; deterministic diff budget,"parse failure, truncation, multiple functions, incompatible/unknown arity, existing target binding, decorators or binding ambiguity, or any required body edit",eligible_for_implementation,false,false
syntax_parse_failure_generic,syntax_parse_failure,saved Pipeline program does not parse,none; collect narrower signatures prospectively before implementation,22,60,Mbpp/103|Mbpp/119|Mbpp/125|Mbpp/138|Mbpp/14|Mbpp/244|Mbpp/259|Mbpp/306|Mbpp/392|Mbpp/430|Mbpp/432|Mbpp/440|Mbpp/603|Mbpp/607|Mbpp/620|Mbpp/622|Mbpp/67|Mbpp/735|Mbpp/739|Mbpp/748|Mbpp/759|Mbpp/765,parse errors include truncation and heterogeneous syntax diagnostics,high,parser diagnostic only,no generic syntax rewrite,always until a narrower independently justified signature exists,insufficient_evidence,false,false
truncation_completion,generation_length_termination,done_reason is not stop,none; missing continuation is not present in saved evidence,24,80,Mbpp/103|Mbpp/11|Mbpp/119|Mbpp/125|Mbpp/138|Mbpp/244|Mbpp/255|Mbpp/259|Mbpp/306|Mbpp/392|Mbpp/410|Mbpp/430|Mbpp/432|Mbpp/440|Mbpp/603|Mbpp/620|Mbpp/622|Mbpp/67|Mbpp/721|Mbpp/735|Mbpp/739|Mbpp/748|Mbpp/765|Mbpp/769,some truncated programs parse; some non-truncated programs fail syntax or semantics,unbounded,termination metadata only,never synthesize missing code,always,nonrepairable,false,false
format_packaging_extraction,format_or_packaging_extraction_failure,extractor reports ambiguous or unsupported packaging,none in Healer; handle prospectively in Scaffold or by the frozen Pipeline extractor,36,68,Mbpp/11|Mbpp/119|Mbpp/124|Mbpp/125|Mbpp/138|Mbpp/16|Mbpp/237|Mbpp/255|Mbpp/259|Mbpp/279|Mbpp/392|Mbpp/406|Mbpp/410|Mbpp/427|Mbpp/432|Mbpp/440|Mbpp/453|Mbpp/473|Mbpp/576|Mbpp/603|Mbpp/615|Mbpp/622|Mbpp/633|Mbpp/67|Mbpp/72|Mbpp/721|Mbpp/722|Mbpp/735|Mbpp/739|Mbpp/748|Mbpp/759|Mbpp/769|Mbpp/771|Mbpp/781|Mbpp/786|Mbpp/787,multiple competing fenced programs cannot be selected safely,high if competing programs are chosen,fence and extraction metadata,do not choose among alternatives,ambiguous multiple payloads,scaffold_or_pipeline_only,false,false
generic_unknown_failure,generic_evaluator_failure_unknown,compile and expected entry checks pass but only generic evaluator failure is saved,none,53,275,Mbpp/103|Mbpp/11|Mbpp/118|Mbpp/119|Mbpp/124|Mbpp/125|Mbpp/138|Mbpp/14|Mbpp/16|Mbpp/237|Mbpp/244|Mbpp/255|Mbpp/259|Mbpp/279|Mbpp/287|Mbpp/392|Mbpp/410|Mbpp/420|Mbpp/427|Mbpp/430|Mbpp/435|Mbpp/440|Mbpp/572|Mbpp/576|Mbpp/581|Mbpp/597|Mbpp/6|Mbpp/603|Mbpp/607|Mbpp/615|Mbpp/620|Mbpp/622|Mbpp/626|Mbpp/633|Mbpp/67|Mbpp/72|Mbpp/721|Mbpp/722|Mbpp/732|Mbpp/735|Mbpp/739|Mbpp/742|Mbpp/748|Mbpp/759|Mbpp/765|Mbpp/769|Mbpp/771|Mbpp/777|Mbpp/781|Mbpp/786|Mbpp/787|Mbpp/792|Mbpp/99,"saved evidence cannot distinguish semantic assertion, runtime, name, or dependency causes",unbounded,insufficient,no evaluator-driven search or acceptance,always,nonrepairable,false,false
import_dependency_unknown,import_or_dependency_failure_uniquely_evidenced,"requires a saved, uniquely identifying static dependency diagnostic",none with current evidence,0,0,,generic evaluator failures cannot be recoded as import failures,high,no uniquely evidenced cells,require explicit static name/dependency proof,all current cells,insufficient_evidence,false,false
