instruction_number,v0_instruction_exact_text,direct_effectiveness_evidence,evidence_strength,possible_overconstraint,causal_status,recommended_action,candidate_rewrite
1,Return exactly one complete Python source file.,"One-file delivery is consistent with multiple fenced programs falling 25->0, but line-specific causality is not isolated.",moderate_aggregate_not_line_specific,May be redundant with output-only wording.,inference,shorten_and_merge,"Return exactly one complete, executable Python source file."
2,Do not use Markdown code fences.,Code-fence markers fell 96->0 and P1 extraction was plain-text pass-through in 100/100 cells.,strong_direct_aggregate,Low; this is the clearest supported constraint.,descriptive_association_with_strong_mechanistic_fit,retain_verbatim_or_near_verbatim,Do not use Markdown code fences.
3,"Do not include explanations, analysis, assertions, tests, print statements, example calls, or alternative implementations.",Extra fence-outside text fell 79->0 and multiple programs fell 25->0; the bundled list prevents line-level attribution.,strong_for_no_explanation_weak_for_each_other_ban,High: banning assertions/tests/prints/examples may compete with task prompts containing assertions and is not separately supported.,part_direct_part_inference,shorten,Do not include explanatory text.
4,Implement the exact function name and parameter list required by the task.,"Pipeline missing-entry failures fell 17->3, but Pipeline correctness stayed 30/100 and line-specific causality is not isolated.",moderate_aggregate,Low to moderate; exact parameter wording may distract when the prompt is ambiguous.,inference,retain_and_shorten,Use the exact function name and parameters required by the task.
5,Include every import required by the submitted program.,No saved import/name failure was identified in either census; unknown failures cannot be recoded as import failures.,insufficient,"Low, but benefit is unobserved.",not_identified,retain_briefly,Include required imports.
6,Do not rename or redefine the requested public function.,"Missing-entry failures fell 17->3, but this line duplicates instruction 4 and redefinition-specific evidence is absent.",weak_redundant,Moderate due redundancy and attention cost.,inference,delete_or_merge_with_4,
7,The response must begin with Python code and contain no text outside the source file.,Extra text fell 79->0 and raw compile pass rose 0->94; effect overlaps instructions 1-3.,strong_aggregate_not_line_specific,Moderate due redundancy.,descriptive_association_line_causality_not_identified,shorten_and_merge,Output only Python code.
